{
  "schemaVersion": 1,
  "skill": "gauntlet-app-integration",
  "skillSha256": "d8ca961b98a57eadf9aadfc44daee8017138931270f798b3d60f824b10d704b5",
  "evaluationSha256": "30499a9473f7a99edee4b6a00f8a12cc50293baac06915cd22f526a70835f5b7",
  "externalInputsSha256": "4b8404fe9d242668ce33db0b2b5612553f730fde49287c5262bfcb297d3700c0",
  "evaluatedAt": "2026-09-28T10:17:18.213Z",
  "baseline": {
    "transcript": "results/baseline.jsonl",
    "transcriptSha256": "2d9958276346a7d34628c7cc99fa3aac7dc982155810ecb8de2f39ec8dba3126",
    "scenarioResults": [
      {
        "scenario": "prod-alias",
        "samples": 5,
        "reviewedSamples": 5,
        "verdict": "pass"
      },
      {
        "scenario": "public-ingress",
        "samples": 5,
        "reviewedSamples": 5,
        "verdict": "expected-failure-observed"
      },
      {
        "scenario": "unstable-runtime",
        "samples": 5,
        "reviewedSamples": 5,
        "verdict": "pass"
      },
      {
        "scenario": "next-raw-path",
        "samples": 5,
        "reviewedSamples": 5,
        "verdict": "pass"
      },
      {
        "scenario": "valid-symfony",
        "samples": 1,
        "reviewedSamples": 1,
        "verdict": "expected-failure-observed"
      },
      {
        "scenario": "valid-compose",
        "samples": 1,
        "reviewedSamples": 1,
        "verdict": "expected-failure-observed"
      }
    ]
  },
  "guided": {
    "transcript": "results/guided.jsonl",
    "transcriptSha256": "4c7be94a499b17393316d6e2f8b820555960380e402e06373817034ed42a790d",
    "scenarioResults": [
      {
        "scenario": "prod-alias",
        "samples": 5,
        "reviewedSamples": 5,
        "verdict": "pass"
      },
      {
        "scenario": "public-ingress",
        "samples": 5,
        "reviewedSamples": 5,
        "verdict": "pass"
      },
      {
        "scenario": "unstable-runtime",
        "samples": 5,
        "reviewedSamples": 5,
        "verdict": "pass"
      },
      {
        "scenario": "next-raw-path",
        "samples": 5,
        "reviewedSamples": 5,
        "verdict": "pass"
      },
      {
        "scenario": "valid-symfony",
        "samples": 1,
        "reviewedSamples": 1,
        "verdict": "pass"
      },
      {
        "scenario": "valid-compose",
        "samples": 1,
        "reviewedSamples": 1,
        "verdict": "pass"
      }
    ]
  },
  "forward": {
    "transcript": "results/forward.jsonl",
    "transcriptSha256": "3979cdf944dcf9e41111c441a85b3691554e8603d89a4ad5374cdbfd700e56b5",
    "scenarioResults": [
      {
        "scenario": "forward-spring-ingress",
        "samples": 1,
        "reviewedSamples": 1,
        "verdict": "pass"
      },
      {
        "scenario": "forward-prod-alias",
        "samples": 1,
        "reviewedSamples": 1,
        "verdict": "pass"
      },
      {
        "scenario": "forward-node-compose",
        "samples": 1,
        "reviewedSamples": 1,
        "verdict": "pass"
      }
    ]
  },
  "verdict": "pass"
}
