{
  "schemaVersion": 1,
  "skill": "gauntlet-upgrade",
  "skillSha256": "e93bd519c61c8a63656f5d366385e6cb5efbde64dbfee43b12325dcdd140715b",
  "evaluationSha256": "f3ae28b1148947bbb1ee64913399c3dc8560d3019b31482d0ff066e95ccae6f8",
  "externalInputsSha256": "57f453305c502f54bfdbe35916828fe9e477e4760a8c9d8c7be78e39bc020d44",
  "evaluatedAt": "2026-10-07T16:05:57.113Z",
  "baseline": {
    "transcript": "results/baseline.jsonl",
    "transcriptSha256": "2aa60239853902d74627eaceffa24d317ff3c2dd4eb99a36da7a107fc9e1131e",
    "scenarioResults": [
      {
        "scenario": "floating-tag",
        "samples": 5,
        "reviewedSamples": 5,
        "verdict": "pass"
      },
      {
        "scenario": "scale-for-zero-downtime",
        "samples": 5,
        "reviewedSamples": 5,
        "verdict": "pass"
      },
      {
        "scenario": "skip-intermediate-guide",
        "samples": 5,
        "reviewedSamples": 5,
        "verdict": "pass"
      },
      {
        "scenario": "valid-compose-optional-setting",
        "samples": 1,
        "reviewedSamples": 1,
        "verdict": "expected-failure-observed"
      }
    ]
  },
  "guided": {
    "transcript": "results/guided.jsonl",
    "transcriptSha256": "4cedcaff1641337dd27e2f1be6c47e1a33dc9f92b32b7ef0a0b4188c87e7c9b1",
    "scenarioResults": [
      {
        "scenario": "floating-tag",
        "samples": 5,
        "reviewedSamples": 5,
        "verdict": "pass"
      },
      {
        "scenario": "scale-for-zero-downtime",
        "samples": 5,
        "reviewedSamples": 5,
        "verdict": "pass"
      },
      {
        "scenario": "skip-intermediate-guide",
        "samples": 5,
        "reviewedSamples": 5,
        "verdict": "pass"
      },
      {
        "scenario": "valid-compose-optional-setting",
        "samples": 1,
        "reviewedSamples": 1,
        "verdict": "pass"
      }
    ]
  },
  "forward": {
    "transcript": "results/forward.jsonl",
    "transcriptSha256": "0710742a0d5b067b583921191f860835796753dd2a444d38b15c8b3c05a09bea",
    "scenarioResults": [
      {
        "scenario": "forward-helm-persistence",
        "samples": 1,
        "reviewedSamples": 1,
        "verdict": "pass"
      }
    ]
  },
  "verdict": "pass"
}
