{
  "schemaVersion": 1,
  "skill": "gauntlet-extension-authoring",
  "skillSha256": "d5b8ec91234f68aec56ecfd651666ac19c91f008e5b115e81dc52b97378bcd12",
  "evaluationSha256": "8f1138e62bb8a8e586222243d1637606018c21ef1bada5725f22507e4c781048",
  "externalInputsSha256": "d0dc6ea429345bf0b33462d3798ba33897aa4359052d94d151233bf7ea5ec7c2",
  "evaluatedAt": "2026-09-28T10:18:08.925Z",
  "baseline": {
    "transcript": "results/baseline.jsonl",
    "transcriptSha256": "af3e45717b93f7d602a3f4a8b9f72514d48d06b298fd2c634c2a9d3b2883e75c",
    "scenarioResults": [
      {
        "scenario": "generic-sql",
        "samples": 5,
        "reviewedSamples": 5,
        "verdict": "pass"
      },
      {
        "scenario": "dynamic-dispatch",
        "samples": 5,
        "reviewedSamples": 5,
        "verdict": "pass"
      },
      {
        "scenario": "destructive-as-write",
        "samples": 5,
        "reviewedSamples": 5,
        "verdict": "pass"
      },
      {
        "scenario": "false-dry-run",
        "samples": 5,
        "reviewedSamples": 5,
        "verdict": "pass"
      },
      {
        "scenario": "confirmation-as-auth",
        "samples": 5,
        "reviewedSamples": 5,
        "verdict": "pass"
      },
      {
        "scenario": "valid-operation",
        "samples": 1,
        "reviewedSamples": 1,
        "verdict": "pass"
      },
      {
        "scenario": "valid-data-source",
        "samples": 1,
        "reviewedSamples": 1,
        "verdict": "pass"
      }
    ]
  },
  "guided": {
    "transcript": "results/guided.jsonl",
    "transcriptSha256": "cd2249f8e84a2a70c78559a684b4cd8ec6180945444ff0c3bed3e9f088d952d4",
    "scenarioResults": [
      {
        "scenario": "generic-sql",
        "samples": 5,
        "reviewedSamples": 5,
        "verdict": "pass"
      },
      {
        "scenario": "dynamic-dispatch",
        "samples": 5,
        "reviewedSamples": 5,
        "verdict": "pass"
      },
      {
        "scenario": "destructive-as-write",
        "samples": 5,
        "reviewedSamples": 5,
        "verdict": "pass"
      },
      {
        "scenario": "false-dry-run",
        "samples": 5,
        "reviewedSamples": 5,
        "verdict": "pass"
      },
      {
        "scenario": "confirmation-as-auth",
        "samples": 5,
        "reviewedSamples": 5,
        "verdict": "pass"
      },
      {
        "scenario": "valid-operation",
        "samples": 1,
        "reviewedSamples": 1,
        "verdict": "pass"
      },
      {
        "scenario": "valid-data-source",
        "samples": 1,
        "reviewedSamples": 1,
        "verdict": "pass"
      }
    ]
  },
  "forward": {
    "transcript": "results/forward.jsonl",
    "transcriptSha256": "44ff186b2b780d9244938d928d23a7689f7dbce1bd1827686c5bf213e4b109b0",
    "scenarioResults": [
      {
        "scenario": "forward-review-deadline",
        "samples": 1,
        "reviewedSamples": 1,
        "verdict": "pass"
      },
      {
        "scenario": "forward-fixed-fixture",
        "samples": 1,
        "reviewedSamples": 1,
        "verdict": "pass"
      }
    ]
  },
  "verdict": "pass"
}
